"**few** delegates obtained results from the survey.","Many delegates obtained interesting results from the survey.",contradiction,neutral
"I bought a new pair of glasses.","I bought a **old** group of products from the optic.",neutral,neutral
"Many aliens read sci-fi novels.","**few** aliens read books.",contradiction,entailment
"Few aliens ate at any restaurants.","**many** aliens ate at Mexican restaurants.",contradiction,entailment
I don't want to get a **partial** denture.,I want to get a full teeth replacement.,entailment,entailment
"A human body consists of a countless number of cells.","A **nonhuman** body consists of a countless number of red blood cells.",neutral,neutral
"Many aliens played with toys.","**few** aliens played with toy cars.",neutral,neutral
"Some of my best friends are cops.","Some of my **worst** friends are troopers.",neutral,neutral
"Dogs have all the good qualities of people without at the **other** time possessing their weaknesses.","Dogs and cats have all the good qualities of people without at the same time possessing their weaknesses.",neutral,neutral
"Every alien who did not eat any meat is **hairless**.","Every alien who did not eat pork is hairy.",neutral,neutral
"No less than fifty campers have ever had a sunburn or caught a cold.","No **morer** than fifty campers have caught a cold.",contradiction,neutral
"I don't like other kinds of drinks.","I don't like **same** kinds of sweet drinks.",contradiction,entailment
"That team has nothing but **weak** players.","That team has nothing but strong workers.",contradiction,neutral
"Don't go to extremes, to be moderate is **unimportant** in anything.","Don't go to ridiculous extremes, to be moderate is important in anything.",contradiction,entailment
"**many** aliens drank any soda.","Few aliens drank coke.",neutral,entailment
"**many** aliens threw balls.","Few aliens threw tennis balls.",neutral,entailment
"Many of the campers have caught a cold.","**few** of the campers have had a sunburn or caught a cold.",entailment,entailment
"Petrol is no longer a cheap fuel.","Petrol is no longer a **expensive** powerful fuel.",contradiction,entailment
"**few** aliens read some magazines.","Many aliens read some news magazines.",contradiction,neutral
"This story doesn't have a **unhappy** concluded ending.","This story doesn't have a happy ending.",contradiction,neutral
"A **small** spider was spinning a web.","A big poison spider was spinning a web.",contradiction,neutral
"Many campers have ever had a sunburn or caught a cold.","**few** campers have caught a cold.",entailment,neutral
"Extraordinary things never happen in simple and ordinary ways.","Extraordinary things never happen in **complex** and ordinary habitual ways.",contradiction,entailment
"**few** aliens threw tennis balls.","Many aliens threw balls.",contradiction,entailment
"Tom had a few good suggestions.","Tom had a few **bad** suggestive remarks to make.",neutral,neutral
"The weather forecast is not **unreliable** at all in summer.","The weather forecast is not reliable at all.",contradiction,neutral
"That shouldn't be too much of a problem.","That shouldn't be too **little** of a hurdle.",contradiction,entailment
"Not many campers have had a sunburn or caught a cold.","Not **few** campers have caught a cold.",contradiction,entailment
"The **earliest** fatal incident, reported Monday morning, killed a 17-year-old boy and wounded a woman.","The latest incident, reported Monday morning, killed a 17-year-old boy and wounded a woman.",neutral,neutral
"Every alien who did not watch baseball matches is **hairless**.","Every alien who did not watch sports matches is hairy.",contradiction,entailment
"Not **few** campers have caught a cold.","Not many campers have had a sunburn or caught a cold.",neutral,neutral
"**few** aliens saw birds.","Many aliens saw doves.",neutral,neutral
People who don't have a computer can't make **partial** use of this mp3 player function.,"People who don't have a powerful computer can't make full use of this mp3 player function.",neutral,entailment
"Few aliens ate at any restaurants.","**many** aliens ate at any Mexican restaurants.",contradiction,entailment
"I bought a new pair of glasses.","I bought a **old** pair of glasses because I need it.",contradiction,neutral
"Every alien who did not read some books is **hairless**.","Every alien who did not read sci-fi novels is hairy.",contradiction,neutral
"If I'd taken the plane which crushed over the ocean, I wouldn't be alive now.","If I'd taken the plane, I wouldn't be **dead** now.",contradiction,neutral
Every gold partner member of the cabinet was not **present**.,"Every member of the cabinet was present.",contradiction,neutral
"A human body consists of a countless number of cells.","A **nonhuman** metabolism consists of a countless number of cells.",neutral,neutral
"Few linguists entered the race.","**many** linguists entered the race early.",contradiction,entailment
"Every unmarried man is a groom for life.","Every **married** grown man is a groom for life.",contradiction,entailment
"All American bills are **dissimilar** in color.","All American dollar bills are similar in color.",contradiction,entailment
"I don't really **unlike** horses.","I don't really like black and tall horses.",neutral,entailment
"I think that most **old** people prefer to listen to rock music.","I think that most young people prefer to listen to rock music from 60s.",neutral,neutral
"**few** aliens threw balls.","Many aliens threw tennis balls.",contradiction,neutral
"Many children decided on the cotton candy.","**few** children chose mint chocolates or decided on the cotton candy.",contradiction,entailment
Tom goes to bed at a **different** time every night in april.,"Tom goes to bed at the same time every night.",entailment,neutral
"Germany has no minimum requirement wage.","Germany has no **maximal** wage.",neutral,neutral
"If you have a question, please raise your **left** hand.","If you have a proper question, please raise your right hand.",contradiction,entailment
"All hegelians are mortal.","All philosophers are **immortal**.",neutral,neutral
"More than five of the children decided on the cotton candy.","**lesser** than five of the children chose any mint chocolates or decided on the cotton candy.",neutral,entailment
"**ordinary** things never happen in simple and ordinary ways.","Extraordinary things never happen in simple and ordinary habitual ways.",neutral,entailment
"Tom doesn't have much interest in outdoor sports.","Tom doesn't have much interest in **indoor** sports to play.",neutral,entailment
"Many delegates obtained interesting results from the survey.","**few** British delegates obtained interesting results from the survey.",neutral,neutral
"Jack can't afford a new bicycle.",Jack can't afford an **old** bicycle or motorbike.,entailment,entailment
You're no longer a baby.,You're no a children **anymore**.,entailment,neutral
"She's wearing a nice summer hat.","She's wearing a **nasty** hat.",contradiction,entailment
"Few aliens saw doves.","**many** aliens saw birds.",neutral,neutral
"Today is not **bad** for me.","Sunday is not good for me.",neutral,neutral
"He has no spatial awareness.","He has no **nonspatial** awareness or similar.",contradiction,entailment
"Every alien who did not buy shirts is hairy.","Every alien who did not buy clothes is **hairless**.",entailment,entailment
"You don't have to go to an Ivy League school to get a good education.","You don't have to go to an Ivy League college to get a **bad** education.",contradiction,entailment
"Sida does not take any **old** decisions on support to projects in the baltic states.","Sida does not take any new decisions on reasonable support to projects in the baltic states.",neutral,entailment
"He is no ordinary master's student.","He is no **extraordinary** student.",contradiction,neutral
"A **small** spider was spinning a awesome web.","A big spider was spinning an web.",neutral,entailment
"Bill never argues with **same** people.","Tom never argues with other people.",neutral,neutral
"I think that most young people prefer to listen to rock music.","I think that most **old** people prefer to listen to heavy metal music.",neutral,neutral
"Few aliens used any quarters.","**many** aliens used coins.",neutral,neutral
"The government has imposed a **old** tax on wine.","The government has imposed a new tax on wine produced before 2004.",contradiction,neutral
"No practical good joker should be without a whoopee cushion.","No **impractical** joker should be without a whoopee cushion.",contradiction,neutral
"He has no **general** aim.","He has no specific strategic aim.",entailment,entailment
"No less than fifty children chose any mint chocolates or decided on the cotton candy.","No **morer** than fifty children decided on the cotton candy.",contradiction,neutral
"My tree had a few blossoms but no ripe fruit.",My tree had **many** blossoms but no fruit.,contradiction,neutral
"Little Sophie was not obedient.","**large** baby girl Sophie was not obedient.",neutral,entailment
"At least one man sang.","At **most** one man sang or danced.",contradiction,entailment
"Some people say thirteen is an **lucky** number.","Some people say thirteen is an unlucky date to propose a girl.",neutral,neutral
"I was in New York for a **many** days.","I was in New York country club for a few days.",neutral,neutral
"No meal is **incomplete** without bread.","No good meal is complete without bread.",entailment,entailment
"I was in New York country club for a **many** days.","I was in New York for a few days.",contradiction,entailment
"At most ten commissioners spend a lot of time at home.","At **fewest** ten commissioners spend time at home.",contradiction,neutral
"**few** aliens used some coins.","Many aliens used quarters.",contradiction,neutral
"**few** aliens ate at restaurants.","Many aliens ate at Mexican restaurants.",contradiction,neutral
"Jack can't afford a **old** bicycle.","Jack can't afford a new bicycle or motorbike.",neutral,entailment
"Understanding a long document requires tracking how entities are introduced and evolve over time.","Understanding a **short** document requires understanding how entities are introduced.",neutral,entailment
"Tom is facing a few serious problems.",Tom is facing **many** serious health problems.,neutral,neutral
"Every alien who did not read some sci-fi novels is **hairless**.","Every alien who did not read books is hairy.",contradiction,entailment
"Few of the books had **atypical** or marginal readers.","Few of the books had (some) typical readers.",contradiction,entailment
"Some of my **worst** friends are cops.","Some of my best friends are troopers.",neutral,neutral
"Every alien who did not buy some clothes is hairy.","Every alien who did not buy shirts is **hairless**.",contradiction,neutral
"She has no **unreal** friends.","She has no real partners.",neutral,entailment
"It is no wonder that a nice man of his ability is successful.","It is no wonder that a man of his ability is **unsuccessful**.",contradiction,neutral
"Every alien who did not play with any toys is hairy.","Every alien who did not play with toy cars is **hairless**.",contradiction,neutral
"No more than five children chose any mint chocolates or decided on the cotton candy.","No **lesser** than five children decided on the cotton candy.",contradiction,entailment
"Just watched the first quarter hour, got bored, skipped to the magic bit, it's funnier as a gif.","Just watched the **last** 15 minutes, got bored, skipped to the magic bit, it's funnier as a gif.",contradiction,entailment
"One thing a married man should never forget is his wedding anniversary.","One thing a **unmarried** older man should never forget is his wedding anniversary.",contradiction,entailment
"I don't really want to pay that much for a new Nissan car.","I don't really want to pay that much for a **old** car.",neutral,neutral
"There are few passengers on this train.","There are **many** passengers with stomach problems on this train.",neutral,neutral
"**many** aliens saw any birds.","Few aliens saw any doves.",neutral,entailment
"The crown prince's mother wouldn't be the first saudi royal whose movements were restricted since June 2017.","The crown prince's mother wouldn't be the **last** royal whose movements were restricted since June 2017.",entailment,entailment
"In many developed areas, **nonhuman** activity has changed the form of river channels, altering magnitudes and frequencies of flooding.","In many areas, human activity has changed the form of river channels, altering magnitudes and frequencies of flooding.",neutral,entailment
"Every alien who did not watch some sports matches is **hairless**.","Every alien who did not watch baseball matches is hairy.",contradiction,neutral
"He has no **general** aim.","He has no specific good aim.",entailment,entailment
"Tom is facing a few serious work problems.","Tom is facing a few **frivolous** problems.",neutral,neutral
"A trivial problem doesn't require **short** contemplation.","A trivial problem doesn't require long lasting contemplation.",contradiction,entailment
"**few** aliens threw some balls.","Many aliens threw some tennis balls.",contradiction,neutral
"This doesn't seem to be a **frivolous** problem for me.","This doesn't seem to be a serious problem.",contradiction,neutral
"At most **whole** children decided on the cotton candy.","At most half children chose any mint chocolates or decided on the cotton candy.",,neutral
"Socrates is rational.","Someone is **irrational**.",,entailment
"Rudolf has built a **small** and white house.","Rudolf has built a large house.",,entailment
"The tanker has only a small crew on board.","The tanker has only a **large** crew on board for being operated.",,entailment
"Tom doesn't spend **little** time in Boston.","Tom doesn't spend much time in business in Boston at all.",,entailment
"Most Europeans who are resident in Europe can travel freely within Europe.","**fewest** Europeans can travel freely within Europe.",,neutral
"Tom doesn't have much interest in outdoor sports.","Tom doesn't have **little** interest in outdoor sports to play.",,entailment
"**middle** rain and early guests seldom stay the night.","Early rainwater and people arriving late make the night a mood.",,neutral
"Tom has never had a good job that he liked.","Tom has never had a **bad** job.",,neutral
"She is not a **bad** sailor.","She is not a good seafarer.",,entailment
"Looking at pictures online of people trying to take photos of mirrors is my new thing.","Looking at pictures online of people trying to take photos of mirrors they want to sell is my **old** thing.",,neutral
"Tom is facing a few serious problems.","Tom is facing a few **frivolous** problems with the law.",,neutral
"Tom isn't very good at sports.","Tom isn't very **bad** at playing outdoor games.",,neutral
"Senator Rosario Ibarra is a human rights militant.","Senator and the great political figure rosario ibarra is a **nonhuman** rights militant.",,neutral
"Few aliens bought any shirts.","**many** aliens bought any clothes.",,neutral
"This hospital has a lot of new equipment.","This office has a lot of **old** desks.",,neutral
"This room doesn't get much morning sun.","This room doesn't get **little** sun.",,neutral
"He is not a good driver at night.","He is not a **bad** driver.",,neutral
"Every alien who did not buy some shirts is **hairless**.","Every alien who did not buy clothes is hairy.",,entailment
"I don't eat Mexicans **ripe** peppers at all.","I don't eat green peppers at all.",,neutral
"Little Sophie was not obedient.","Little girl Sophie was not **disobedient**.",,entailment
"She's wearing a **nasty** hat.","She's wearing a nice big hat.",,neutral
"The crown prince's mother wouldn't be the **last** royal whose movements were restricted since June 2017.","The crown prince's mother wouldn't be the first saudi royal whose movements were restricted since June 2017.",,neutral
"Some large birds prey upon **large** birds and animals.","Some large owls prey upon small birds and animals.",,neutral
"A **sighted** man shouldn't play cards.","A blind man should n’t play cards and board games at all.",,entailment
"Every alien who did not see some birds is **hairless**.","Every alien who did not see doves is hairy.",,neutral
"**lesser** than five campers have caught a cold.","More than five campers have had a sunburn or caught a cold.",,entailment
"Many aliens ate at some Mexican restaurants.","**few** aliens ate at restaurants.",,entailment
"I have never felt prouder in my whole life.","I have never felt happier and prouder in my **fractional** life.",,entailment
"No **lesser** than fifty children decided on the cotton candy.","No more than fifty children chose mint chocolates or decided on the cotton candy.",,neutral
"A human body consists of a countless number of red blood cells.","A **nonhuman** body consists of a countless number of cells.",,entailment
"Germany has no minimum wage.","Germany does not impose **maximal** wage.",,entailment
"Tom has never eaten **cooked** adult horse meat.","Tom has never eaten raw horse meat.",,neutral
"The word came to be used for all small heavenly bodies revolving about larger ones.","The word came to be used for all small heavenly artificial bodies revolving about **smaller** ones.",,entailment
"Every alien who did not eat at some restaurants is **hairless**.","Every alien who did not eat at Mexican restaurants is hairy.",,neutral
"So there is no **undedicated** high-dimensional memory block for every entity and no distinction between entity mentions and non-mention words.","So there is no dedicated memory block for every entity and no distinction between entity mentions and non-mention words.",,neutral
"**many** aliens drank any coke.","Few aliens drank soda.",,neutral
"The park is busy every cold season.","The park is **idle** every season.",,neutral
"Tom has never eaten **cooked** horse meat.","Tom has never eaten raw adult horse meat.",,entailment
"No more than fifty children decided on the cotton candy.","No **lesser** than fifty children chose any mint chocolates or decided on the cotton candy.",,neutral
"Tom doesn't spend **little** time in Boston.","Tom doesn't spend much time for study in Boston.",,entailment
"Today isn't my lucky day!","Halloween isn't my **unlucky** day!",,neutral
"Every unmarried man from my city is a groom for life.","Every **married** man is a groom for life.",,neutral
"This story doesn't have a **unhappy** brilliant ending.","This story doesn't have a happy ending.",,neutral
"The word came to be used for all small heavenly bodies revolving about larger ones.","The word came to be used for all **large** heavenly artificial bodies revolving about larger ones.",,entailment
"Many aliens watched some baseball matches.","**few** aliens watched some sports matches.",,entailment
"If I'd taken the plane yesterday, I wouldn't be **dead** now.","If I'd taken the plane, I wouldn't be alive now.",,neutral
"If I'd taken the plane, I wouldn't be **dead** now.","If I'd taken the blue plane, I wouldn't be alive now.",,entailment
"Most people don't like hospitals.","**fewest** people don't like bad hospitals.",,entailment
"Extraordinary things never happen in simple and ordinary ways.","**ordinary** things never happen in simple and ordinary ways they are complicated.",,entailment
"A trivial problem doesn't require **short** contemplation.","A trivial problem doesn't require long review.",,entailment
"Germany has no **maximal** wage.","Germany does not impose minimum wage.",,entailment
"**many** aliens threw any tennis balls.","Few aliens threw any balls.",,neutral
"Very **many** children chose any mint chocolates or decided on the cotton candy.","Very few children decided on the cotton candy.",,entailment
"All American bills are similar in color.","All American dollar bills are **dissimilar** in color.",,entailment
"Winter does not look real without snow.","Winter does not look **unreal** without ice.",,neutral
"Several Portuguese delegates got the results published in major national newspapers.","Several delegates got the results published in **minor** national newspapers.",,entailment
"In grounded communication tasks, speakers face pressures in choosing referential expressions that distinguish their targets from others in the context, leading to **few** kinds of pragmatic meaning enrichment.","In grounded communication tasks, speakers face pressures in choosing referential expressions that distinguish their targets from others in the context, leading to many kinds of meaning enrichment.",,entailment
"Few aliens read books.","**many** aliens read sci-fi novels.",,entailment
"That **white** bird is not a blackbird.","That black bird is not a true blackbird.",,entailment
"At least half campers have caught a cold.","At **most** half campers have had a sunburn or caught a cold.",,entailment
"A **small** spider was spinning a web.","A big wanderer was spinning a web.",,neutral
"Not **few** of the campers have ever had a sunburn or caught a cold.","Not many of the campers have caught a cold.",,entailment
"Tom doesn't have a steady girlfriend.","Tom doesn't have a **unsteady** pretty girlfriend.",,entailment
"Tom has never had a **bad** job.","Tom has never had a good job that he liked.",,entailment
"I could never afford a beach house as nice as that.","I could never afford a house as **nasty** as that.",,neutral
"Tom has a **many** friends in Boston subuerbs.","Tom has a few friends in Boston.",,entailment
"If the tedious school wasn't **optional**, I would stop going there.","If school wasn't obligatory, I would stop going there.",,neutral
"Few aliens played with toy cars.","**many** aliens played with toys.",,neutral
"**few** of the books had typical readers.","Many of the books had typical or marginal readers.",,entailment
"**morer** than five children decided on the cotton candy.","Less than five children chose mint chocolates or decided on the cotton candy.",,neutral
"At least **whole** children decided on the cotton candy.","At least half children chose mint chocolates or decided on the cotton candy.",,entailment
"Just watched the **last** quarter hour, got bored, skipped to the magic bit, it's funnier as a gif.","Just watched the first 15 minutes, got bored, skipped to the magic bit, it's funnier as a gif.",,entailment
"Few aliens threw tennis balls.","**many** aliens threw balls.",,neutral
"Tom doesn't like modern art.","Tom doesn't like **nonmodern** great art.",,entailment
"You're absolutely perfect, in every way.","You're absolutely **imperfect**, in every each way.",,entailment
"I have not yet collected **insufficient** materials to write a book.","I have not yet collected sufficient data to write a book.",,entailment
"Many aliens read books.","**few** aliens read sci-fi novels.",,neutral
"Many aliens read some news magazines.","**few** aliens read magazines.",,entailment
"Cruz has frequently derided as amnesty any plan that confers **illegal** status or citizenship on people living in the country illegally.","Cruz has frequently derided as amnesty any bill that confers legal status or citizenship on people living in the country illegally.",,entailment
"A **nonhuman** body consists of a countless number of cells.","A human metabolism consists of a countless number of cells.",,neutral
"I don't want to miss **unhappy** hour.","I don't want to miss happy breakfast hour.",,entailment
"He believed that blacks could win their fight for equal rights without  widespread violence.","He believed that blacks could win their fight for **unequal** rights without violence.",,neutral
"**few** people in Fiji don't have access to clean warm drinking water.","Many people in Fiji don't have access to clean drinking water.",,neutral
"Many aliens read some sci-fi novels.","**few** aliens read some books.",,entailment
"We didn't have much trouble.","We didn't have **little** trouble about stealing this.",,entailment
"No less than fifty campers have caught a cold.","No **morer** than fifty campers have ever had a sunburn or caught a cold.",,entailment
"Every alien who did not see any birds is hairy.","Every alien who did not see doves is **hairless**.",,neutral
"I don't really **unlike** horses.","I don't really like wild horses.",,entailment
"**fewest** Americans can't speak German.","Most Americans can't speak German spoken in hamburg.",,entailment
"Today is not **bad** for me.","Monday is not good for me.",,neutral
"If I'd taken the plane, I wouldn't be alive now.","If I'd taken the plane which crushed over the ocean, I wouldn't be **dead** now.",,entailment
"Many people in Fiji don't have access to clean drinking hot water.","**few** people in Fiji don't have access at all to clean drinking water.",,neutral
"Every student has **unfree** access to the library.","Every new student has free access to the library.",,entailment
"A good tree can't bear bad tropical fruits.","A good tree can't bear **good** fruits.",,neutral
"The word came to be used for all small heavenly artificial bodies revolving about **smaller** ones.","The word came to be used for all small heavenly bodies revolving about larger ones.",,neutral
"Extraordinary things never happen in simple and **extraordinary** ways.","Extraordinary things never happen in simple and ordinary ways they are complicated.",,entailment
"No **lesser** than fifty campers have caught a cold.","No more than fifty campers have had a sunburn or caught a cold.",,neutral
"Petrol is no longer a **expensive** fuel.","Petrol is no longer a cheap fossil.",,entailment
"Every body is busy except me.","Every person is **idle** except me.",,entailment
