"If high school wasn't obligatory, I would stop going there.","If school was **optional**, I would stop going there.",entailment,neutral
"A good tree can't bear bad tropical fruits.","A **bad** tree can't bear bad fruits.",neutral,neutral
"**Many** aliens played with any toy cars.","Few aliens played with toys.",contradiction,neutral
"Petrol is no longer an **expensive** fuel.","Petrol is no longer a cheap entity.",contradiction,entailment
"This isn't a good sign of being healthy.","This isn't a **bad** sign.",neutral,neutral
"He is no ordinary undergraduate student.","He is no **extraordinary** student.",neutral,neutral
"Extraordinary things never happen in simple and **extraordinary** ways.","Extraordinary things never happen in simple and ordinary normal ways.",contradiction,entailment
"**Few** aliens ate at some restaurants.","Many aliens ate at Mexican restaurants.",contradiction,neutral
"Every unmarried grown man is a groom for life.","Every **married** man is a groom for life.",neutral,neutral
"I didn't understand that last sentence.","I didn't understand that **first** sentence you wrote.",neutral,entailment
"Tom isn't a **good** coach.","Tom isn't a bad coach for his team players.",contradiction,entailment
"Some of my **worst** friends are cops and lawyers.","Some of my best friends are cops.",neutral,entailment
"I don't like **light** makeup on a young girl.","I don't like heavy makeup on a young lassie.",neutral,entailment
"At **most** five dots are red.","At least five dots are scarlet.",contradiction,neutral
"Every alien who did not watch some baseball matches is hairy.","Every alien who did not watch sports matches is **hairless**.",contradiction,entailment
"Picasso was no clown, and he was a sarcastic commentator on a confused age, a great archivist of humanity's foolishness.","Picasso was no jester, and he was a sarcastic commentator on a **clearheaded** age, a great archivist of humanity's foolishness.",contradiction,entailment
"Very few of the children chose any mint chocolates or decided on the cotton candy.","Very **many** of the children decided on the cotton candy.",contradiction,entailment
"Every sentence in that book is important.","Every sentence in that syllabus book is **unimportant**.",neutral,neutral
"**Less** than half of the tenors are sick.","More than half of the tenors have the flu.",contradiction,neutral
"Tom has never had a good job.","Tom has never had a **bad** job that he liked.",neutral,entailment
"**Few** aliens bought clothes.","Many aliens bought shirts.",contradiction,neutral
"He believed that blacks could win their fight for equal rights without violence.","He believed that blacks could win their fight for **unequal** rights without generalized violence.",neutral,entailment
"I'm an **abnormal** girl.","I'm a normal virgin.",neutral,neutral
"No **more** than fifty children chose mint chocolates or decided on the cotton candy.","No less than fifty children decided on the cotton candy.",neutral,neutral
"Many children chose mint chocolates or decided on the cotton candy.","**Few** children decided on the cotton candy.",neutral,neutral
"I won't play second fiddle for anyone.","I won't play **first** strange fiddle for anyone.",neutral,entailment
"Rudolf has built a **small** house.","Rudolf bush has built a large house.",neutral,neutral
"**More** than five children chose mint chocolates or decided on the cotton candy.","Less than five children decided on the cotton candy.",neutral,entailment
"I didn't say a **common** word.","I didn't say a single famous word.",neutral,entailment
"I was in the hospital for **many** hard days.","I was in the hospital for a few days.",contradiction,entailment
"**Less** than half of the tenors have the flu.","More than half of the tenors are sick.",neutral,entailment
"**Many** aliens threw any balls.","Few aliens threw any tennis balls.",neutral,entailment
"Not many of the campers have caught a cold.","**Few** of the campers have had a sunburn or caught a cold.",neutral,neutral
"I have a **bad** appetite for Italian food.","I don't have a good appetite.",neutral,neutral
"A **sighted** man should play cards.","A blind man shouldn't play cards without help.",neutral,entailment
"Every student has free access to the library.","Every high school student has **restricted** access to the library.",contradiction,entailment
"Petrol is no longer a cheap fuel.","Petrol is now an **expensive** available fuel.",entailment,entailment
"I'm a **abnormal** beautiful girl.","I'm a normal girl.",contradiction,entailment
"I think that **fewest** young people prefer to listen to rock music from 60s.","I think that most young people prefer to listen to rock music.",neutral,entailment
"A cold bath refreshed him.","A **hot** pool refreshed him.",contradiction,neutral
"Tom has never eaten **cooked** horse meat.","Tom has never eaten raw horse meat yet.",neutral,entailment
"Many aliens used some quarters.","**Few** aliens used coins.",contradiction,entailment
"You don't have to go to an Ivy League educational institution to get a good education.","You don't have to go to an Ivy League college to get a **bad** education.",neutral,entailment
"Tom really leads no easy life.","Tom really leads no **difficult** free life.",contradiction,entailment
"I bought a new pair of glasses.","I bought an **old** pair of red glasses.",contradiction,neutral
"Many people in Fiji don't have access to clean drinking water.","**Few** people in Fiji have simple access to clean drinking water.",entailment,entailment
"Dogs have all the good qualities of people **while** at the same time possessing their weaknesses.","Dogs and all pets have all the good qualities of people without at the same time possessing their weaknesses.",contradiction,neutral
"At least five dots are scarlet.","At **most** five dots are red.",contradiction,entailment
"Tom has never eaten raw adult horse meat.","Tom has already eaten **cooked** horse meat.",neutral,neutral
"I could never afford a house as nice as that.","I could afford a big house as **nasty** as that.",neutral,entailment
"**More** than five children decided on the cotton candy.","Less than five children chose any mint chocolates or decided on the cotton candy.",contradiction,neutral
"**Many** linguists entered the race early.","Few linguists entered the race.",contradiction,neutral
"This story doesn't have a **unhappy** ending.","This story doesn't have a happy ending for the reader.",contradiction,entailment
"Every unmarried man from my town is a groom for life.","Every **married** man is a groom for life.",neutral,neutral
"Tom is a bad coach.","Tom isn't a **good** football coach.",entailment,entailment
"**Few** people in Fiji don't have access to clean drinking water.","Many people in Fiji don't have access to clean drinking water on foot at all.",contradiction,entailment
"**Few** delegates obtained interesting results from the survey.","Many delegates obtained results from the survey.",neutral,entailment
"I want to miss **unhappy** hour.","I don't want to miss happy hour tomorrow.",neutral,entailment
"All hegelians are **immortal**.","All philosophers are mortal.",contradiction,neutral
"Not many of the children chose mint chocolates or decided on the cotton candy.","**Few** of the children decided on the cotton candy.",entailment,entailment
"Go to extremes, to be **immoderate** is important in anything.","Don't go to silly extremes, to be moderate is important in anything.",contradiction,entailment
"Many aliens played with some toys.","**Few** aliens played with toy cars.",neutral,neutral
"A trivial problem doesn't require long contemplation.","A trivial problem requires only **short** time.",entailment,entailment
"Tom has an **unsteady** favorite girlfriend.","Tom doesn't have a steady girlfriend.",neutral,neutral
"The park is **idle** every season.","The park is busy every tourist season.",contradiction,entailment
"Expectedly, I felt a sharp pain in my stomach.","All of a sudden, i felt a sharp constant pain in my stomach.",contradiction,neutral
"Tom is facing **many** serious problems to face exams.","Tom is facing a few serious problems.",contradiction,entailment
"None of the sopranos sang with fewer than three of the male singers.","None of the sopranos sang with **more** than three of the tenors.",contradiction,neutral
"He was watchful for any sign of diabetes.","He was **unalert** for any sign of worsen.",contradiction,neutral
"She slept for a few hours.","She slept for **many** dreamless hours.",contradiction,neutral
"Every alien who did not drink some coke is **hairless**.","Every alien who did not drink soda is hairy.",contradiction,entailment
"I dig **nonmodern** and contemporary jazz.","I don't dig modern jazz.",neutral,neutral
"Cruz has frequently derided as amnesty any bill that confers legal status or citizenship on people living in the country illegally.","Cruz has frequently derided as amnesty any plan that confers **illegal** status or citizenship on people living in the country illegally.",neutral,neutral
"All Tom wanted was a **nasty** hot and relaxing bath.","All Tom wanted was a nice hot bath.",contradiction,entailment
"At **most** half children chose mint chocolates or decided on the cotton candy.","At least half children decided on the cotton candy.",contradiction,neutral
"I'm not a little girl anymore.","I'm a **grown** girl now.",entailment,entailment
"Excitement isn't good for a man of my age.","Frightful excitement is **bad** for a man of my age.",entailment,neutral
"Tom really leads no easy life.","Tom really leads a **difficult** life all those years.",entailment,entailment
"If i were a foreigner, i probably couldn't eat **cooked** fish.","If i were a foreigner, i probably couldn't eat raw fish from the sea.",neutral,entailment
"The first pleasurable experience I had interacting with another **nonhuman** being was at the age of seventeen.","The first displeasurable experience I had interacting with another human being was at the age of seventeen.",neutral,neutral
"The word came to be used for all **large** heavenly bodies revolving about larger ones.","The word came to be used for all small heavenly artificial bodies revolving about larger ones.",neutral,entailment
"There is no scientific basis for these claims.","There is an **unscientific** basis from you for these claims.",neutral,entailment
"The park is **idle** every tourist season.","The park is busy every season.",contradiction,neutral
"John inherited a **small** fortune.","John inherited a large house.",contradiction,neutral
"**Few** aliens ate at Mexican restaurants.","Many aliens ate at restaurants.",neutral,entailment
"**Ordinary** things never happen in simple and ordinary habitual ways.","Extraordinary things never happen in simple and ordinary ways.",neutral,neutral
"Several delegates got the results published in major national newspapers.","Several Portuguese delegates got the results published in **minor** national newspapers.",neutral,neutral
"If I were a foreigner, I probably couldn't eat **cooked** fish.","If i were a tourist, i probably couldn't eat raw fish.",neutral,entailment
"Tom has never eaten **cooked** horse meat.","Tom has never eaten raw American horse meat.",neutral,entailment
"The word came to be used for all small heavenly dusty bodies revolving about larger ones.","The word came to be used for all small heavenly bodies revolving about **smaller** ones.",neutral,neutral
"At **most** one man sang.","At least one man sang and danced.",neutral,neutral
"I don't care **little** for coffee.","I don't care much for hot coffee.",contradiction,entailment
"**More** than five of campers have ever had a sunburn or caught a cold.","Less than five of campers have caught a cold.",neutral,entailment
"John inherited a large fortune.","John inherited a **small** fortune and beauty jewerly.",contradiction,neutral
"Many aliens bought clothes.","**Few** aliens bought shirts.",neutral,neutral
"The park is **idle** every season.","The park is busy every season in the afternoon.",contradiction,entailment
"At least one man sang and danced.","At **most** one man danced.",neutral,entailment
"Rock climbing without proper equipment is dangerous.","Rock climbing without **improper** equipment of good quality is dangerous.",neutral,entailment
"Don't go to extremes, to be moderate is **unimportant** in anything.","Don't go to that level of extremes, to be moderate is important in anything.",contradiction,entailment
"**Fewest** dots are red.","Most dots are scarlet.",contradiction,neutral
"More than five children decided on the cotton candy.","**Less** than five children chose mint chocolates or decided on the cotton candy.",contradiction,entailment
"I bought a new pair of glasses.","I bought an **old** jacket.",neutral,neutral
"**Fewest** Americans can speak old German language.","Most Americans can't speak German.",neutral,neutral
"If I were a foreigner, I probably couldn't eat raw fish.","If I were a foreigner, I probably could eat **cooked** fish for dinner.",neutral,entailment
"While **fewest** successful approaches for reading comprehension rely on recurrent neural networks (RNNs), running them over long documents is prohibitively slow because it is difficult to parallelize over sequences.","While most approaches for reading comprehension rely on recurrent neural networks (RNNs), running them over long documents is prohibitively slow because it is difficult to parallelize over sequences.",contradiction,neutral
"He is a fast runner in spain.","He is no **slow** runner.",entailment,entailment
"He has a **general** aim.","He has no specific objective.",neutral,entailment
"People who regularly work **indoors** suffer from lack of deep sleep.","People who regularly work in the open air do not suffer from sleeplessness.",neutral,neutral
"In many developed areas, human activity has changed the form of river channels, altering magnitudes and frequencies of flooding.","In **few** areas, human activity has changed the form of river channels, altering magnitudes and frequencies of flooding.",contradiction,entailment
"Every alien who did not see any doves is **hairless**.","Every alien who did not see birds is hairy.",contradiction,entailment
"This story doesn't have an **unhappy** ending for the reader.","This story doesn't have a happy ending.",contradiction,neutral
"No words can express her deep sorrow.","No words whatsoever can express her **shallow** sorrow.",contradiction,entailment
"Germany decided to not use any more **conventional** energy.","Sweden decided to not use any more nuclear energy.",neutral,neutral
"Germany decided to not use any more **conventional** energy.","France decided to not use any more nuclear energy.",neutral,neutral
"A **hot** bath refreshed him.","A cold pool refreshed him.",contradiction,neutral
"I haven't used anki in a week and now i have 500 flashcards due.","I haven't used anki device in a week and now i have 500 flashcards **undue**.",neutral,entailment
"Madonna's concert drew a **small** audience.","Madonna's concert drew a large audience in the us.",contradiction,neutral
"It is **little** fun going mountain climbing by yourself.","It isn't much fun and exciting going mountain climbing by yourself.",entailment,entailment
"I bought a few eggs and a little milk.","I bought a few apples and a **large** milk.",contradiction,neutral
"A doe is a female deer.","A doe is an **androgynous** white deer.",contradiction,neutral
"I have **narrow** hips.","I don't have wide hips after all.",entailment,entailment
"A good tree can bear **good** fruits.","A good tree can't bear bad fruits if you care about it.",neutral,entailment
"Every alien who did not drive any suvs is hairy.","Every alien who did not drive cars is **hairless**.",contradiction,entailment
"I was in the hospital for **many** days.","I was in the hospital for a few hard days.",neutral,neutral
"A **small** spider was spinning a web.","A big araña peluda was spinning a web.",contradiction,neutral
"I see no other course of action.","I see **a** wiser course of action.",contradiction,entailment
"At **most** three pachyderms are pink.","At least three elephants are pink.",neutral,neutral
"He believed that blacks could win their fight for **unequal** rights without widespread violence.","He believed that blacks could win their fight for equal rights without violence.",neutral,neutral
"The world court has no power to enforce its orders but its decisions have traditionally carried some **undiplomatic** weight.","The world court has no watt to enforce its orders but its decisions have traditionally carried some diplomatic weight.",contradiction,entailment
"Many people in Fiji don't have public access to clean drinking water.","**Few** people in Fiji have access to clean drinking water.",neutral,neutral
"A **hot** bath refreshed him.","A cold jacuzzi refreshed him.",contradiction,neutral
"Extraordinary things never happen in **complex** and ordinary habitual ways.","Extraordinary things never happen in simple and ordinary ways.",neutral,neutral
"The world court has no power to enforce its orders but its decisions have traditionally carried some **undiplomatic** weight.","The world court has no assets to enforce its orders but its decisions have traditionally carried some diplomatic weight.",contradiction,entailment
"**Few** people in Fiji have simple access to clean drinking water.","Many people in Fiji don't have access to clean drinking water.",neutral,neutral
"Every alien who did not eat some meat is **hairless**.","Every alien who did not eat pork is hairy.",contradiction,neutral
"He sang some old songs.","He sang some **young** country songs.",contradiction,neutral
"Farragut captured new orleans without a fight.","Farragut captured **old** orleans without a fierce fight.",neutral,entailment
"Every alien who did not play with any toy cars is **hairless**.","Every alien who did not play with toys is hairy.",contradiction,entailment
"I don't eat green peppers at all.","I don't eat rotten **ripe** peppers at all.",neutral,entailment
"**Fewest** Americans can speak German.","Most Americans can't speak German because it is not their native language.",entailment,entailment
"Few aliens drove any cars.","**Many** aliens drove suvs.",contradiction,entailment
"This is a **bad** sign about the situation.","This isn't a good sign.",neutral,neutral
"He has **every** right to do this.","He has no right to do this.",contradiction,entailment
"If I'd taken the plane, I would be **dead** now.","If I'd taken the plane yesterday, I wouldn't be alive now.",entailment,entailment
"Every alien who did not buy any shirts is hairy.","Every alien who did not buy clothes is **hairless**.",contradiction,entailment
"Tom isn't a good drama writer.","Tom is a **bad** writer.",neutral,neutral
"Tom isn't a **good** football coach.","Tom is a bad coach.",neutral,neutral
"Few female committee members are from southern Europe.","**Many** committee members are from southern Europe.",neutral,neutral
"I see no other course of action.","I see **some** other particular course of action.",contradiction,entailment
"The word came to be used for all small heavenly bodies revolving about **smaller** ones.","The word came to be used for all small heavenly dusty bodies revolving about larger ones.",neutral,entailment
"Extraordinary things never happen in simple and ordinary ways they are complicated.","Extraordinary things never happen in **complex** and ordinary ways.",contradiction,neutral
"Some of my best friends are cops.","Some of my **worst** friends are cops and lawyers.",neutral,neutral
"Petrol is no longer a **expensive** fuel.","Petrol is no longer a cheap powerful fuel.",contradiction,entailment
"Very **many** campers have ever had a sunburn or caught a cold.","Very few campers have caught a cold.",neutral,entailment
"Tom has never eaten raw horse red meat.","Tom has never eaten **cooked** horse meat.",neutral,neutral
"It is no wonder that a man of his ability is successful.","It is no wonder that a nice man of his ability is **unsuccessful**.",contradiction,entailment
"Tom and Mary were speaking to each other in a language i didn't recognize.","Tom and Mary were speaking to each **same** in a recognizable language i didn't recognize.",neutral,neutral
"She has been studying French for a **many** years.","She has been studying some foreign languages like korean for a few years.",neutral,neutral
"If Esperanto were an **difficult** language, I wouldn't need a proofreader.","If Esperanto were an easy language just like chinese, I wouldn't need a proofreader.",contradiction,entailment
"I have never felt prouder in my **fractional** life.","I have never felt gratified in my whole life.",neutral,entailment
"No more than five campers have had a sunburn or caught a cold.","No **lesser** than five campers have caught a cold.",contradiction,entailment
"I was in New York country club for a few days.",I was in New York for **many** days.,contradiction,entailment
"A cold bubbly bath refreshed him.","A **hot** bath refreshed him.",contradiction,neutral
"**few** of the campers have caught a cold.","Many of the campers have had a sunburn or caught a cold.",neutral,entailment
**Most** people don't like bad hospitals.,"Most people don't like hospitals.",contradiction,neutral
"She slept for a few dreamless hours.",She slept for **many** hours.,neutral,neutral
"Today isn't my **unlucky** day!","Halloween isn't my lucky day!",entailment,neutral
"People who regularly work in the **shut** air do not suffer from sleeplessness.","People who regularly work in the open air do not suffer from diseases called insomnia.",entailment,entailment
"I bought a few eggs and a little milk.",I bought **many** chicken eggs and a little milk.,contradiction,neutral
"You have no **illegal** right to seize my property.","You have no legal permission to seize my property.",contradiction,entailment
"He expressed his opinion in a **many** words.","He expressed his opinion in a few paragraphs.",contradiction,neutral
"This isn't a good sign.","This isn't a **bad** sign of being healthy.",contradiction,entailment
"No meal is **incomplete** without bread.","No sophisticated meal is complete without bread.",contradiction,entailment
"Tom isn't a bad high school coach.","Tom isn't a **good** coach.",contradiction,neutral
"Regional governors could not rely on the king for help in times of crisis, and the ensuing food shortages and political disputes escalated into famines and small-scale civil wars.","Regional governors could not rely on anyone for help in times of crisis, and the ensuing food shortages and political disputes escalated into famines and small-scale **uncivil** wars.",contradiction,neutral
"John inherited a large fortune and a nice car.","John inherited a **small** fortune.",contradiction,entailment
"In **few** areas, human activity has changed the form of river channels, altering magnitudes and frequencies of flooding.","In many developed areas, human activity has changed the form of river channels, altering magnitudes and frequencies of flooding.",entailment,neutral
"Regional governors could not rely on the king for help in times of crisis, and the ensuing food shortages and political disputes escalated into famines and small-scale civil wars.","Regional governors could not rely on anyone for help in times of crisis, and the ensuing food shortages and **nonpolitical** disputes escalated into famines and small-scale civil wars.",contradiction,neutral
"Many aliens played with toy cars.","**few** aliens played with toys.",contradiction,entailment
"If you have a question, please raise your right hand.","If you have a good question, please raise your **left** hand.",contradiction,entailment
"Most peanut farmers entered the race.","**fewest** peanut farmers entered the race early.",neutral,neutral
"Understanding a **short** document requires tracking how entities are introduced and evolve over time.","Understanding a long document requires understanding how entities are introduced.",neutral,entailment
I want to get a **partial** denture.,"I don't want to get a full perfect denture.",entailment,entailment
"At least five children chose mint chocolates or decided on the cotton candy.","At **most** five children decided on the cotton candy.",contradiction,neutral
Tom really leads not **difficult** life.,"Tom really leads no easy and peaceful life.",contradiction,entailment
"John inherited a large fortune.","John inherited a **small** house.",neutral,neutral
"All the passengers are in mortal danger.","All the passengers are in **immortal** danger and fear.",contradiction,neutral
"Not many of the campers have had a sunburn or caught a cold.","Not **few** of the campers have caught a cold.",contradiction,entailment
"Tom couldn't find a **bad** place to hide.","Tom couldn't find a good and big place to hide.",contradiction,entailment
Tom bought an **old** pair of shoes in three years.,Tom hasn't bought a new pair of good shoes in three years.,entailment,entailment
"The first displeasurable experience I had interacting with another **nonhuman** being was at the age of seventeen.","The first pleasurable experience I had interacting with another human being was at the age of seventeen.",contradiction,neutral
"The government has imposed a new tax on wine produced before 2004.","The government has imposed a **old** tax on wine.",contradiction,entailment
"If Esperanto were an easy language I wouldn't need a proofreader.","If Esperanto were an **difficult** language I wouldn't need a proofreader or a translator.",contradiction,entailment
"**lesser** than five of campers have caught a cold.","More than five of campers have had a sunburn or caught a cold.",contradiction,entailment
