Tom doesn't spend little time in Boston today.,Tom doesn't spend much time in Boston.,neutral
Many aliens bought shirts.,Few aliens bought clothes.,contradiction
Tom was wearing a white hat.,Tom was wearing a black sweater.,neutral
Every alien who did not eat some pork is hairy.,Every alien who did not eat meat is hairless.,contradiction
"If nonhuman life is convex, we can optimize it.","If human life is unusual and convex, we can optimize it.",neutral
There are no other good options.,There are no better options.,neutral
Few people in Fiji don't have access to clean drinking water.,Many people in Fiji don't have basic access to clean drinking water.,contradiction
There are many passengers on this train.,There are few passengers with stomach problems on this train.,neutral
I have seen bill recently.,I haven't seen uncle bill for a long time.,contradiction
Tom hasn't bought a new pair of shoes in three years.,Tom has bought a new pair of adidas shoes in the past three years.,contradiction
"All of a gradual, i felt a sharp constant pain in my stomach.","All of a sudden, i felt a sharp pain in my stomach.",contradiction
You're still children.,You're no longer teenagers.,contradiction
Stracciatella ice-cream is nothing but a fancy ice-cream with chocolate chips.,Algida ice-cream is nothing but a plain ice-cream with chocolate chips.,neutral
He believed that blacks could win their fight for unequal rights without violence.,He believed that blacks could win their fight for equal rights without violence and rioting.,neutral
I was in the hospital for a few days.,I was in the hospital for many days last month.,contradiction
Few aliens drove any suvs.,Many aliens drove any cars.,neutral
At most half children decided on the cotton candy.,At most all children chose any mint chocolates or decided on the cotton candy.,neutral
Senator Rosario Ibarra is a human rights militant.,Senator activist is a nonhuman rights militant.,neutral
Rudolf has built a small pent house with pool.,Rudolf has built a large pent house.,neutral
At least three pachyderms are pink.,At most three elephants are pink.,neutral
None of the passengers is in mortal danger and fear.,All the passengers are in mortal danger.,neutral
The first pleasurable experience I had interacting with another human being was at the age of seventeen.,The last experience I had interacting with another human being was at the age of seventeen.,neutral
Tom goes to bed at a different time every night in winter.,Tom goes to bed at the same time every night.,contradiction
Every unmarried man is a groom for life.,Every married man from my city is a groom for life.,contradiction
"We combed police records of the incident but found no mention of witnesses seeing a short, bearded man.","We combed police records of the incident but found no unexpected mention of witnesses seeing a tall, bearded man.",neutral
The first displeasurable experience I had interacting with another human being was at the age of seventeen.,The last pleasurable experience I had interacting with another human being was at the age of seventeen.,neutral
You don't have to go to an Ivy League college to get a bad education.,You don't have to go to an Ivy League French college to get a good education.,neutral
Few children decided on the cotton candy.,Many children chose any mint chocolates or decided on the cotton candy.,neutral
Every alien who did not read some magazines is hairless.,Every alien who did not read news magazines is hairy.,contradiction
I just want to sleep for a few hours.,I just want to sleep for many minutes to recover from fatigue.,neutral
I don't answer stupid questions that tend to offend me.,I don't answer smart questions.,neutral
Every member of the cabinet was absent.,Every particular member of the cabinet was present.,contradiction
I could never afford a house as nasty as that.,I could never afford a beach house as nice as that.,neutral
Cruz has frequently derided as amnesty any plan that confers legal status or citizenship on people living in the country illegally.,Cruz has frequently derided as amnesty any bill that confers illegal status or citizenship on people living in the country illegally.,neutral
Not a few pupils could solve the problem.,Not many good pupils could solve the problem.,neutral
I don't really want to pay that much for a new car.,I don't really want to pay that much for a old Nissan car.,neutral
It is no wonder that a man of his ability is unsuccessful.,It is no wonder that a human of his ability is successful.,contradiction
Every tall man from Japan ran quickly.,Every short man ran.,neutral
There's no same way to do this.,There's no other alternative way to do this.,neutral
I've never seen a fat strict vegan.,I've never seen a thin vegan.,neutral
Germany decided to not use any more nuclear energy.,Sweden decided to not use any more conventional energy.,neutral
A doe is a male white deer.,A doe is a female deer.,contradiction
You're no longer babies.,You're still children.,neutral
Large Sophie was not obedient.,Little baby girl Sophie was not obedient.,neutral
I was in the hospital for many days last month.,I was in the hospital for a few days.,contradiction
Not few of the campers have had a sunburn or caught a cold.,Not many of the campers have caught a cold.,neutral
I wish you all a Merry Christmas and a Happy New Year.,I sincerely wish you all a Merry Christmas and a unhappy New Year.,contradiction
At fewest half campers have caught a cold.,At most half campers have ever had a sunburn or caught a cold.,contradiction
Rock climbing without proper equipment is dangerous.,Rock climbing without proper reliable equipment is safe.,contradiction
Some small birds hunt and prey upon small birds and animals.,Some large birds prey upon small birds and animals.,neutral
Many aliens ate some meat.,Few aliens ate some pork.,neutral
No less than fifty campers have caught a cold.,No more than fifty campers have ever had a sunburn or caught a cold.,contradiction
Tom isn't a good writer.,Tom isn't a bad drama writer.,contradiction
"Picasso was no clown, and he was a unsarcastic commentator on a confused age, a great archivist of humanity's foolishness.","Picasso was no jester, and he was a sarcastic commentator on a confused age, a great archivist of humanity's foolishness.",contradiction
"You're absolutely imperfect, in every way.","You're absolutely perfect, in every each way.",contradiction
That shouldn't be too much of a problem.,That shouldn't be too little of a problem at home.,neutral
"If it's a nasty day tomorrow, we'll go on a picnic.","If it's a nice day tomorrow, we'll go on a horse riding.",neutral
This story doesn't have a happy adorable ending.,This story doesn't have a unhappy ending.,neutral
You can't have a rainbow without a large rain.,You can't have a rainbow in the sky without a little rain.,neutral
I have made little progress.,I have made much progress in work.,contradiction
Many of the books had atypical readers.,Many of the books had typical or marginal readers.,neutral
Tom was wearing a white hat.,Tom was wearing a black golfer.,neutral
This story doesn't have a unhappy ending.,This story doesn't have a happy adorable ending.,neutral
Many aliens ate some meat.,Few aliens ate pork.,neutral
Arabic isn't a easy language.,Arabic isn't a difficult and very complicated language.,neutral
He sang some new songs.,He sang some old country songs.,neutral
There's no same way to do this.,There's no other simpler way to do this.,neutral
I don't really like horses.,I don't really hate black and tall horses.,neutral
Extraordinary things never happen in simple and ordinary ways.,Ordinary things never happen in simple and ordinary usual ways.,neutral
Few aliens drank some coke.,Many aliens drank some soda.,neutral
There are no worse options.,There are no better kind of options.,neutral
Many delegates obtained interesting results from the survey.,Few delegates obtained results from the survey.,contradiction
Few aliens watched baseball matches.,Many aliens watched sports matches.,neutral
Few female committee members are from southern Europe.,Few committee members are from northern Europe.,neutral
Germany has no maximal requirement wage.,Germany has no minimum wage.,neutral
It is no wonder that a man of his ability is so successful.,It is no wonder that a good man of his ability is so unsuccessful.,neutral
People who don't have a computer can't make full use of this mp3 player function.,People who don't have a personal computer can't make partially use of this mp3 player function.,neutral
At least a few committee members are from Scandinavia.,Many female committee members are from Scandinavia.,neutral
Every member of the cabinet was absent.,Every gold partner member of the cabinet was present.,contradiction
Dogs and cats have all the good qualities of people without at the other time possessing their weaknesses.,Dogs have all the good qualities of people without at the same time possessing their weaknesses.,neutral
Little Sophie was not obedient.,Little baby Sophie was not disobedient.,contradiction
I have never felt prouder in my fractional life.,I have never felt happier and prouder in my whole life.,neutral
"You're absolutely perfect, in every way.","You're absolutely imperfect, in every possible way.",contradiction
Not a few houses were destroyed in the typhoon.,Not many homesteads were destroyed in the typhoon.,contradiction
At least all children chose mint chocolates or decided on the cotton candy.,At least half children decided on the cotton candy.,neutral
At most five campers have ever had a sunburn or caught a cold.,At least five campers have caught a cold.,contradiction
He added a little sugar to the coffee.,He added a large saccharin to the coffee.,neutral
I don't want to get a full denture.,I don't want to get a empty strong denture.,neutral
Every alien who did not read any news magazines is hairless.,Every alien who did not read magazines is hairy.,contradiction
Every new student has free access to the library.,Every student has unfree access to the library.,neutral
"Tom doesn't want an IPad, but he wants a portable device that supports flash.","Tom doesn't want an iproduct, but he wants a unportable device that supports flash.",neutral
More than five campers have caught a cold.,Less than five campers have ever had a sunburn or caught a cold.,contradiction
At most five campers have caught a cold.,At least five campers have had a sunburn or caught a cold.,neutral
"If school wasn't optional, I would stop going there.","If high school wasn't obligatory, I would stop going there.",neutral
You shouldn't read useful books.,You shouldn't read useless fairy tales.,neutral
At most three commissioners spend time at home.,At least three male commissioners spend time at home.,contradiction
Few aliens saw birds.,Many aliens saw doves.,contradiction
You don't have to go to an Ivy League college to get a good education.,You don't have to go to an Ivy League French college to get a bad education.,neutral
Many aliens read news magazines.,Few aliens read magazines.,contradiction
At fewest half campers have ever had a sunburn or caught a cold.,At most half campers have caught a cold.,contradiction
Extraordinary things never happen in simple and ordinary ways they are complicated.,Extraordinary things never happen in simple and extraordinary ways.,neutral
My tree had many blossoms but no fruit.,My tree had a many blossoms but few fruits to eat.,contradiction
Every alien who did not eat some meat is hairy.,Every alien who did not eat pork is hairless.,contradiction
Few people in Fiji don't have access to clean drinking water.,Many people in Fiji don't have access at all to clean drinking hot water.,neutral
Very many children chose mint chocolates or decided on the cotton candy.,Very few children decided on the cotton candy.,neutral
Every alien who did not buy any clothes is hairless.,Every alien who did not buy shirts is hairy.,contradiction
Tom swims every other day.,Tom swims in pool every same day.,neutral
"If i were a foreigner, i probably couldn't eat cooked fish.","If i were a foreigner, i probably couldn't eat raw fish or meat.",neutral
Tom is facing a few serious problems.,Tom is facing a few frivolous work problems.,neutral
Madonna's concert drew a small and loud audience.,Madonna's concert drew a large audience.,contradiction
My first car didn't have power steering.,My last car didn't have electric power steering.,neutral
Few aliens read some books.,Many aliens read some sci-fi novels.,neutral
Few people in Fiji don't have access to clean drinking water.,Many people in Fiji don't have access to clean drinking running water.,neutral
Every alien who did not use any coins is hairless.,Every alien who did not use quarters is hairy.,contradiction
Many aliens threw balls.,Few aliens threw tennis balls.,neutral
Senator Rosario Ibarra is a human rights militant.,Senator poltician is a nonhuman rights militant.,neutral
"If i were a foreigner, i probably couldn't eat raw fish.","If i were a tourist, i probably couldn't eat cooked fish.",neutral
Most Americans can't speak German.,Fewest Americans can't speak German because it is not their native language.,contradiction
Every alien who did not buy clothes is hairless.,Every alien who did not buy shirts is hairy.,contradiction
"If human life is convex, we can optimize it.","If human life is unusual and concave, we can optimize it.",neutral
Dogs have all the good qualities of people without at the same time possessing their weaknesses.,Dogs and all pets have all the bad qualities of people without at the same time possessing their weaknesses.,neutral
At most one man sang and danced.,At least one man danced.,neutral
Many delegates obtained interesting results from the survey.,Many British delegates obtained uninteresting results from the survey.,neutral
Tom hasn't bought a old pair of shoes in three years.,Tom hasn't bought a new pair of adidas shoes in three years.,neutral
Every alien who did not read sci-fi novels is hairy.,Every alien who did not read books is hairless.,contradiction
You know that some actions must be taken when grandma reacts with the glad emoji.,You know that some life changing actions must be taken when grandma reacts with the sad emoji.,neutral
A good tree can't bear bad fruits.,A good tree can't bear good tropical fruits.,contradiction
Many aliens watched sports matches.,Few aliens watched baseball matches.,neutral
Many people in Fiji don't have access to clean drinking water on foot at all.,Few people in Fiji don't have access to clean drinking water.,neutral
Every alien who did not watch some baseball matches is hairless.,Every alien who did not watch sports matches is hairy.,contradiction
"If nonhuman life is convex, we can optimize it.","If human hard life is convex, we can optimize it.",neutral
She has been studying French for many days.,She has been studying French for a few years.,neutral
Many aliens saw doves.,Few aliens saw birds.,contradiction
Few aliens played with any toy cars.,Many aliens played with any toys.,neutral
He is not a bad driver in snow conditions.,He is not a good driver.,neutral
The crown prince's mother wouldn't be the first royal whose movements were restricted since June 2017.,The crown prince's mother wouldn't be the last saudi royal whose movements were restricted since June 2017.,neutral
John is short.,John is very tall.,contradiction
No more than five children decided on the cotton candy.,No less than five children chose any mint chocolates or decided on the cotton candy.,neutral
Tom is facing a few frivolous problems.,Tom is facing a few serious health problems.,neutral
I don't dig nonmodern jazz.,I don't dig modern and contemporary jazz.,neutral
Arabic isn't a difficult language.,Arabic isn't a easy and very complicated language.,neutral
A forest doe is a female deer.,A doe is a androgynous deer.,neutral
Tom was wearing a black hat.,Tom was wearing a white scarf.,neutral
Few aliens ate at any Mexican restaurants.,Many aliens ate at any restaurants.,neutral
He believed that blacks could win their fight for unequal rights without violence.,He believed that blacks could win their fight for equal rights without generalized violence.,neutral
My father fixed a unbroken chair.,My father fixed a broken car.,neutral
Tom isn't a good student.,Tom isn't a bad science student.,neutral
The world court has no city power to enforce its orders but its decisions have traditionally carried some undiplomatic weight.,The world court has no power to enforce its orders but its decisions have traditionally carried some diplomatic weight.,neutral
This story doesn't have a unhappy ending.,This story doesn't have a happy concluded ending.,neutral
"If you have a question, please raise your left hand.","If you have a question not resolved, please raise your right hand.",contradiction
You can't have a rainbow without a large rain.,You can't have a colour spectrum without a little rain.,neutral
It is no wonder that a man of his ability is unsuccessful.,It is no wonder that a good looking man of his ability is successful.,contradiction
Many of the books had typical readers.,Few of the books had typical or marginal readers.,contradiction
Tom hasn't bought a new pair of adidas shoes in three years.,Tom hasn't bought a old pair of shoes in three years.,neutral
People who regularly work in the open air do not suffer from sleeplessness.,People who regularly work in the shut air do not suffer from lack of deep sleep.,neutral
Most dots are scarlet.,Fewest dots are red.,neutral
Every alien who did not read some books is hairy.,Every alien who did not read sci-fi novels is hairless.,contradiction
He believed that blacks could win their fight for equal rights without any serious violence.,He believed that blacks could win their fight for unequal rights without violence.,neutral
Few aliens drove any suvs.,Many aliens drove cars.,neutral
More than half of the tenors have the flu.,Less than half of the tenors are sick.,contradiction
John inherited a large fortune and beauty jewerly.,John inherited a small fortune.,contradiction
Few aliens saw doves.,Many aliens saw birds.,neutral
Every alien who did not eat at Mexican restaurants is hairy.,Every alien who did not eat at restaurants is hairless.,contradiction
She has no spatial awareness.,She has no nonspatial awareness of good life.,neutral
Farragut captured new orleans with a fight.,Farragut captured new orleans without a single problem or any kind of dispute.,contradiction
Many aliens bought any shirts.,Few aliens bought any clothes.,contradiction
I don't dig modern jazz.,I don't dig nonmodern combo jazz.,neutral
Tom really leads no easy free life.,Tom really leads no difficult life.,neutral
"If you have a question, please raise your left hand.","If you want to ask a question, please raise your right hand.",contradiction
He added a large sugar to the coffee.,He added a little saccharin to the coffee.,neutral
Tom has never had a good job in his field of expertise.,Tom has never had a bad job.,contradiction
He believed that blacks could win their fight for equal rights without violence.,He believed that blacks could win their fight for unequal rights without any serious violence.,neutral
I can't drink sour stuff.,I can't drink sweet alcoholic stuff.,neutral
He owns a public jet.,He owns a private helicopter.,neutral
"If human life is concave, we can optimize it.","If human hard life is convex, we can optimize it.",neutral
I'll do my worst to have no regrets.,I'll do my best to have no regrets for this issue.,contradiction
Tom hasn't bought a old pair of good shoes in three years.,Tom hasn't bought a new pair of shoes in three years.,neutral
Arabic isn't a difficult language.,Arabic isn't a easy world language.,neutral
Few aliens watched baseball matches.,Many aliens watched sports matches.,neutral
Many British delegates obtained uninteresting results from the survey.,Many delegates obtained interesting results from the survey.,neutral
Few aliens played with toy cars.,Many aliens played with toys.,neutral
I bought a few stamps.,I bought a many pesos.,neutral
I don't want to miss happy hour to enjoy with my friends.,I don't want to miss unhappy hour.,neutral
No words can express her shallow sorrow.,No words whatsoever can express her deep sorrow.,neutral
My father fixed a unbroken chair.,My father fixed a broken cabinet.,neutral
I wouldn't like to meet him in a dark place.,I wouldn't like to meet him in a light area.,neutral
Mr. Thomas had no objection to mr. black being elected chairman.,Mr. Thomas had no true objection to mr. white being elected chairman.,neutral
Many aliens read sci-fi novels.,Few aliens read books.,contradiction
I'm not a large girl anymore.,I'm not a little female child anymore.,neutral
Some small birds prey upon small birds and animals.,Some large owls prey upon small birds and animals.,neutral
I bought a many eggs and a little milk.,I bought a few chicken eggs and a little milk.,neutral
Few people in Fiji don't have basic access to clean drinking water.,Many people in Fiji don't have access to clean drinking water.,neutral
"If I'd taken the unfortunate plane, I wouldn't be alive now.","If I'd taken the plane, I wouldn't be dead now.",contradiction
John inherited a small fortune and beauty jewerly.,John inherited a large fortune.,contradiction
The first experience I had interacting with another human being was at the age of seventeen.,The last pleasurable experience I had interacting with another human being was at the age of seventeen.,neutral
Arabic isn't a easy language.,Arabic isn't a difficult world language.,neutral
Every alien who did not eat at some restaurants is hairy.,Every alien who did not eat at Mexican restaurants is hairless.,contradiction
Tom doesn't spend much time in Boston today.,Tom doesn't spend little time in Boston.,neutral
Tom has a few friends in Boston.,Tom has a many friends in Texas.,neutral
It is no wonder that a man of his ability is unsuccessful.,It is no wonder that a capable man of his ability is successful.,contradiction
Few aliens used coins.,Many aliens used quarters.,contradiction
Every alien who did not play with toy cars is hairy.,Every alien who did not play with toys is hairless.,contradiction
Not few campers have had a sunburn or caught a cold.,Not many campers have caught a cold.,neutral
More than five of campers have caught a cold.,Less than five of campers have had a sunburn or caught a cold.,neutral
John inherited a small fortune.,John inherited a large horse.,neutral
At least half campers have had a sunburn or caught a cold.,At most half campers have caught a cold.,neutral
The talk between labor and management yielded no definite results.,The talk between labor and management yielded no indefinite earnings.,neutral
All the passengers are in mortal danger and fear.,All the passengers are in immortal danger.,contradiction
We have some finished business.,We have some unfinished songs.,neutral
Every alien who did not throw some tennis balls is hairless.,Every alien who did not throw balls is hairy.,contradiction
My first car didn't have power steering.,My last car didn't have hydraulic power steering.,neutral
Rock climbing without proper equipment is dangerous.,Rock climbing without improper reliable equipment is dangerous.,neutral
Rudolf has built a large house.,Rudolf has built a small building.,neutral
At fewest three elephants are blue.,At most three elephants are navy blue.,neutral
Many aliens drank some soda.,Few aliens drank some coke.,neutral
Many people in Fiji don't have access to clean drinking water.,Few people in Fiji don't have access to clean and safe drinking water.,neutral
Rudolf has built a large house.,Rudolf has built a small and white house.,neutral
The talk between labor and management yielded no indefinite results.,The talk between labor and management yielded no definite agreements.,neutral
"Don't go to extremes, to be moderate is important in anything.","Don't go to ridiculous extremes, to be moderate is unimportant in anything.",contradiction
We didn't have little trouble.,We didn't have much trouble about stealing this.,neutral
He was unalert for any sign of diabetes.,He was watchful for any sign of worsen.,neutral
Tom was wearing a white hat.,Tom was wearing a black jacket.,neutral
I bought a few eggs and a little milk.,I bought a many creamers and a little milk.,neutral
I don't have a bad appetite.,I don't have a good appetite for vegetable.,neutral
Every body here is idle except me.,Every body is busy except me.,contradiction
The tanker has only a large crew on board.,The tanker has only a small crew on board for being operated.,contradiction
"Regional governors could not rely on the king for help in times of crisis, and the ensuing food shortages and political disputes escalated into famines and small-scale uncivil wars.","Regional governors could not rely on anyone for help in times of crisis, and the ensuing food shortages and political disputes escalated into famines and small-scale civil wars.",neutral
Few aliens bought some clothes.,Many aliens bought some shirts.,contradiction
Every alien who did not see some birds is hairy.,Every alien who did not see doves is hairless.,contradiction
He believed that blacks could win their fight for equal rights without violence and rioting.,He believed that blacks could win their fight for unequal rights without violence.,neutral
At least half children chose mint chocolates or decided on the cotton candy.,At least all children decided on the cotton candy.,contradiction
