Not a few houses were destroyed in the typhoon.,Not a many houses and buildings were destroyed in the typhoon.,entailment
"The latest fatal incident, reported Monday morning, killed a 17-year-old boy and wounded a woman.","The earliest incident, reported Monday morning, killed a 17-year-old boy and wounded a woman.",neutral
People who regularly work in the shut air do not suffer from sleeplessness.,People who regularly work in the open air do not suffer from lack of deep sleep.,entailment
My last car didn't have electric power steering.,My first car didn't have power steering.,neutral
Few people in Fiji don't have access to clean drinking water.,Many people in Fiji don't have access to clean and safe drinking water.,entailment
I haven't made much progress in work.,I haven't made little progress.,neutral
Tom is facing a few serious problems.,Tom is facing a many serious health problems.,neutral
Every member of the cabinet was present.,Every gold partner member of the cabinet was future.,entailment
He is not a bad driver at night.,He is not a good driver.,neutral
That shouldn't be too little of a problem.,That shouldn't be too much of a problem at home.,entailment
A doe is a androgynous deer.,A doe is a female white deer.,neutral
I don't have wide hips.,I don't have narrow hips after all.,entailment
Many people in Fiji don't have access to clean drinking water in workplaces.,Few people in Fiji don't have access to clean drinking water.,neutral
Many aliens used any coins.,Few aliens used quarters.,entailment
Few aliens watched any sports matches.,Many aliens watched baseball matches.,entailment
No morer than fifty children chose mint chocolates or decided on the cotton candy.,No less than fifty children decided on the cotton candy.,neutral
He is a fast runner.,He is a slow careerist.,neutral
Extraordinary things never happen in simple and ordinary ways.,Extraordinary things never happen in complex and ordinary normal ways.,entailment
Every member of the cabinet was future.,Every female member of the cabinet was present.,entailment
At least one man danced.,At most one man sang or danced.,entailment
"If I'd taken the blue plane, I wouldn't be dead now.","If I'd taken the plane, I wouldn't be alive now.",neutral
Not a many pupils could solve the problem.,Not a few good pupils could solve the problem.,entailment
Mr. Thomas had no objection to mr. black being elected chairman.,Mr. Thomas had no objection at all to mr. white being elected chairman.,entailment
No less than five children decided on the cotton candy.,No morer than five children chose any mint chocolates or decided on the cotton candy.,entailment
You can't have a rainbow without a large rain.,You can't have a rainbow in the sky without a little rain.,entailment
Many aliens ate meat.,Few aliens ate pork.,neutral
Many delegates obtained interesting results from the survey.,Few British delegates obtained interesting results from the survey.,neutral
"If Esperanto were an difficult language, I wouldn't need a proofreader.","If Esperanto were an easy language for me, I wouldn't need a proofreader.",entailment
At most whole children decided on the cotton candy.,At most half children chose any mint chocolates or decided on the cotton candy.,neutral
You shouldn't read useless fairy tales.,You shouldn't read useful books.,neutral
At least five children chose mint chocolates or decided on the cotton candy.,At most five children decided on the cotton candy.,neutral
Winter does not look real without snow.,Winter does not look unreal without ice.,neutral
Every alien who did not read sci-fi novels is hairless.,Every alien who did not read books is hairy.,entailment
Extraordinary things never happen in simple and ordinary ways they are complicated.,Ordinary things never happen in simple and ordinary ways.,neutral
I could never afford a colorful house as nice as that.,I could never afford a house as nasty as that.,neutral
John is very short.,John is tall.,entailment
Ordinary things never happen in simple and ordinary ways.,Extraordinary things never happen in simple and ordinary manner.,entailment
I'm a abnormal girl.,I'm a normal beautiful girl.,neutral
I wish you all a Merry Christmas and a unhappy New Year.,"I wish you all a joy, a Merry Christmas and a Happy New Year.",entailment
Extraordinary things never happen in simple and ordinary ways.,Ordinary things never happen in simple and ordinary ways they are complicated.,entailment
Very many of campers have caught a cold.,Very few of campers have ever had a sunburn or caught a cold.,neutral
All others classical albums are same.,All other albums are different.,neutral
A old oil tanker was launched.,A new truck was launched.,neutral
I don't have a good appetite for vegetable.,I don't have a bad appetite.,neutral
A human body consists of a countless number of cells.,A nonhuman metabolism consists of a countless number of cells.,neutral
Every alien who did not watch sports matches is hairless.,Every alien who did not watch baseball matches is hairy.,neutral
At most five dots are scarlet.,At least five dots are red.,entailment
"In my opinion, impermanent peace is nothing but illusion.","In my opinion, permanent health is nothing but illusion.",neutral
"We combed police records of the incident but found no mention of witnesses seeing a short, bearded man.","We combed police records of the incident but found no precise mention of witnesses seeing a tall, bearded man.",entailment
Extraordinary things never happen in simple and ordinary ways.,Extraordinary things never happen in simple and extraordinary manner.,entailment
No more than fifty children chose mint chocolates or decided on the cotton candy.,No lesser than fifty children decided on the cotton candy.,entailment
I've never seen a fat strict vegan.,I've never seen a thin vegan.,neutral
Every member of the cabinet was present.,Every particular member of the cabinet was future.,entailment
Extraordinary things never happen in complex and ordinary ways.,Extraordinary things never happen in simple and ordinary manner.,entailment
Many aliens used any quarters.,Few aliens used any coins.,neutral
Tom is facing a few frivolous work problems.,Tom is facing a few serious problems.,neutral
I don't want to get a full denture.,I don't want to get a empty perfect denture.,entailment
Very few children chose any mint chocolates or decided on the cotton candy.,Very many children decided on the cotton candy.,entailment
He owns a private jet.,He owns a public helicopter.,neutral
Today isn't my unlucky day!,My birthday isn't my lucky day!,neutral
He has no right to do this.,He has no left to do this.,entailment
There's no other way to do this.,There's no same simpler way to do this.,entailment
At least half children decided on the cotton candy.,At least whole children chose mint chocolates or decided on the cotton candy.,entailment
No less than fifty children decided on the cotton candy.,No morer than fifty children chose mint chocolates or decided on the cotton candy.,entailment
Morer than five dots are scarlet.,Fewer than five dots are red.,neutral
I don't like heavy makeup on a female child under 18.,I do not like light makeup in a young girl.,neutral
Few of the books had typical or marginal readers.,Many of the books had (some) typical readers.,entailment
"If the grain is good, spice won't help.","If the grain is bad, flavoring won't help.",neutral
This story doesn't have a happy ending.,This story doesn't have a unhappy concluded ending.,entailment
Tom has never eaten cooked horse meat.,Tom has never eaten raw adult horse meat.,entailment
You don't have to go to an Ivy League college to get a good education.,You don't have to go to an Ivy League English college to get a bad education.,entailment
Some things that Tom told me aren't true.,Some things about my wife that Tom told me aren't false.,neutral
It is no wonder that a man of his ability is so unsuccessful.,It is no wonder that a person of his ability is so successful.,entailment
Tom doesn't have hairless arms.,Tom doesn't have hairy black arms.,entailment
A small spider was spinning a awesome web.,A big spider was spinning an web.,entailment
At least three commissioners spend time at home.,At most three commissioners spend a lot of time at home.,neutral
None of the sopranos sang with morer than three of the male singers.,None of the sopranos sang with fewer than three of the tenors.,neutral
Every alien who did not eat at some restaurants is hairless.,Every alien who did not eat at Mexican restaurants is hairy.,neutral
I think that fewest young people prefer to listen to rock music.,I think that most addicts prefer to listen to rock music.,neutral
He expressed his opinion in a many words.,He expressed his opinion in a few paragraphs.,neutral
Few aliens ate some pork.,Many aliens ate meat.,entailment
She has no nonspatial awareness of good life.,She has no spatial awareness.,neutral
No less than fifty campers have ever had a sunburn or caught a cold.,No morer than fifty campers have caught a cold.,neutral
"We combed police records of the incident but found no clear mention of witnesses seeing a tall, bearded man.","We combed police records of the incident but found no mention of witnesses seeing a short, bearded man.",neutral
"You're absolutely imperfect, in every way.","You're absolutely perfect, in every each way.",entailment
No lesser than five campers have caught a cold.,No more than five campers have ever had a sunburn or caught a cold.,neutral
Tom doesn't have much interest in indoor sports.,Tom doesn't have much interest in outdoor sports to play.,entailment
Every alien who did not use quarters is hairy.,Every alien who did not use coins is hairless.,entailment
I see no same course of action.,I see no other particular course of action.,entailment
Many aliens read some sci-fi novels.,Few aliens read some books.,entailment
"If I'd taken the plane which crushed over the ocean, I wouldn't be dead now.","If I'd taken the plane, I wouldn't be alive now.",neutral
There's no other way to do this.,There's no same way or means to do this.,entailment
Germany decided to not use any more nuclear energy.,Sweden decided to not use any more conventional energy.,neutral
I don't want to make old friends!,I don't want to make new chum!,entailment
At most half children chose any mint chocolates or decided on the cotton candy.,At most whole children decided on the cotton candy.,entailment
Tom isn't a bad student.,Tom isn't a good science student.,entailment
He has no nonspatial awareness.,He has no spatial awareness or similar.,entailment
Very many of the children decided on the cotton candy.,Very few of the children chose mint chocolates or decided on the cotton candy.,neutral
He is a slow runner.,He is a fast runner in spain.,neutral
"Don't go to extremes, to be moderate is important in anything.","Don't go to silly extremes, to be immoderate is important in anything.",entailment
A big poison spider was spinning a web.,A small spider was spinning a web.,entailment
Many aliens drank some soda.,Few aliens drank some coke.,neutral
Tom really leads no easy life.,Tom really leads no difficult life of his own.,entailment
Few aliens played with any toys.,Many aliens played with any toy cars.,entailment
"If i were a foreigner, i probably couldn't eat cooked fish.","If i were a foreigner, i probably couldn't eat raw fish for dinner.",entailment
Few people in Fiji don't have access to clean drinking water.,Many people in Fiji don't have access to clean drinking water for safe health.,entailment
Tom has never had a good job that he liked.,Tom has never had a bad job.,neutral
John inherited a small fortune and beauty jewerly.,John inherited a large fortune.,entailment
I think that most young people prefer to listen to rock music.,I think that most old people prefer to listen to heavy metal music.,neutral
I don't want to miss happy hour.,I don't want to miss unhappy hour today.,entailment
"If i were a foreigner, i probably couldn't eat cooked fish for dinner.","If i were a foreigner, i probably couldn't eat raw fish.",neutral
I don't dig nonmodern jazz in New York.,I don't dig modern jazz.,neutral
Jane didn't die a natural death.,Jane didn't die a unnatural death with no pain.,entailment
I don't want to miss unhappy hour.,I don't want to miss happy hour today.,entailment
I don't like heavy makeup on a young girl.,I don't like light makeup on a young woman.,entailment
I don't really want to pay that much for a old car.,I don't really want to pay that much for a new Nissan car.,entailment
Not few of the children chose any mint chocolates or decided on the cotton candy.,Not many of the children decided on the cotton candy.,entailment
Not few children decided on the cotton candy.,Not many children chose mint chocolates or decided on the cotton candy.,neutral
Few men farmers entered the race early.,Many men entered the race.,entailment
Not few campers have ever had a sunburn or caught a cold.,Not many campers have caught a cold.,entailment
At least five campers have caught a cold.,At most five campers have had a sunburn or caught a cold.,entailment
Most Americans can't speak German.,Fewest Americans can't speak old German language.,entailment
I have no lesser ideas.,I have no more new ideas.,entailment
I don't like heavy makeup on a young girl.,I don't like heavy makeup on a old lassie.,entailment
Few aliens drank some soda.,Many aliens drank some coke.,neutral
Tom isn't a good coach.,Tom isn't a bad coach for his team players.,entailment
Every alien who did not read some sci-fi novels is hairless.,Every alien who did not read books is hairy.,entailment
Fewest peanut farmers entered the race.,Most peanut farmers entered the race early.,neutral
At least half children decided on the cotton candy.,At least whole children chose any mint chocolates or decided on the cotton candy.,entailment
Tom is facing a many serious problems.,Tom is facing a few serious work problems.,neutral
Many aliens drove suvs.,Few aliens drove cars.,entailment
At most three elephants are blue.,At least three elephants are navy blue.,neutral
"If it's a nasty day tomorrow, we'll go on a picnic.","If it's a nice day tomorrow, we'll go on a horse riding.",neutral
A big spider was spinning a web.,A small spider was spinning a light.,neutral
Tom isn't good at math.,Tom is not bad at exact sciences.,neutral
I don't really want to pay that much for a old car.,I don't really want to pay that much for a new red car.,entailment
Rudolf has built a small house.,Rudolf has built a large and beautiful house.,neutral
Sida does not take any new decisions on support to projects in the baltic states.,Sida does not take any old decisions on feasible support to projects in the baltic states.,entailment
Several Portuguese delegates got the results published in major national newspapers.,Several delegates got the results published in major international newspapers.,entailment
Every alien who did not watch any baseball matches is hairy.,Every alien who did not watch sports matches is hairless.,entailment
I'll do my worst to have no regrets.,I'll do my best to have no possible regrets.,entailment
Tom doesn't have much interest in outdoor sports to play.,Tom doesn't have much interest in indoor sports.,neutral
I don't need a long lecture.,I don't need a short lecture.,neutral
John inherited a large fortune and a nice car.,John inherited a small fortune.,entailment
Less than five children decided on the cotton candy.,Morer than five children chose any mint chocolates or decided on the cotton candy.,neutral
"You're absolutely perfect, in every way.","You're absolutely imperfect, in every each way.",entailment
"While most successful approaches for reading comprehension rely on recurrent neural networks (RNNs), running them over long documents is prohibitively slow because it is difficult to parallelize over sequences.","While fewest approaches for reading comprehension rely on recurrent neural networks (RNNs), running them over long documents is prohibitively slow because it is difficult to parallelize over sequences.",neutral
Tom doesn't like nonmodern art.,Tom doesn't like modern great art.,entailment
A nonhuman body consists of a countless number of cells.,A human body consists of a countless number of mesh.,neutral
Every student has free access to the library.,Every high school student has unfree access to the library.,entailment
He had a fatal lack of ability to think logically.,He had a nonfatal lack of capacity to think logically.,entailment
"All of a gradual, i felt a sharp constant pain in my stomach.","All of a sudden, i felt a sharp pain in my stomach.",entailment
Rudolf has built a small pent house with pool.,Rudolf has built a large pent house.,entailment
We consider some words as negative examples and sample negatives at random from the dictionary.,We consider some context words as positive examples and sample negatives at random from the dictionary.,neutral
He was watchful for any sign of diabetes.,He was unalert for any sign of worsen.,neutral
I don't like light makeup on a young girl.,I don't like heavy makeup on a young lassie.,entailment
Some unimportant documents on criminal proceedings are missing from the files.,Some important papers are missing from the files.,entailment
Dogs have all the bad qualities of people without at the same time possessing their weaknesses.,Dogs and cats have all the good qualities of people without at the same time possessing their weaknesses.,neutral
Every alien who did not use coins is hairless.,Every alien who did not use quarters is hairy.,neutral
My tree had a many blossoms but no ripe fruit.,My tree had a few blossoms but no fruit.,neutral
No lesser than five children chose any mint chocolates or decided on the cotton candy.,No more than five children decided on the cotton candy.,entailment
I didn't understand that first sentence.,I didn't understand that last sentence you wrote.,entailment
Few aliens played with toys.,Many aliens played with toy cars.,neutral
Petrol is no longer a cheap powerful fuel.,Petrol is no longer a expensive fuel.,neutral
Every alien who did not throw some tennis balls is hairless.,Every alien who did not throw balls is hairy.,entailment
Morer than five of campers have had a sunburn or caught a cold.,Less than five of campers have caught a cold.,entailment
This story doesn't have a unhappy ending.,This story doesn't have a happy concluded ending.,entailment
Tom has a few friends in Boston subuerbs.,Tom has a many friends in Boston.,entailment
Bill never argues with same people.,Tom never argues with other people.,neutral
Few of the children chose any mint chocolates or decided on the cotton candy.,Many of the children decided on the cotton candy.,neutral
I see no other course of action.,I see no same wiser course of action.,entailment
Every alien who did not use any coins is hairy.,Every alien who did not use quarters is hairless.,neutral
Tom isn't a bad high school coach.,Tom isn't a good coach.,neutral
A sad accident took place yesterday.,A glad accident took place yesterday at the junction.,neutral
The government has imposed a old tax on famous wine.,The government has imposed a new tax on wine.,entailment
There are no other good options.,There are no same options.,neutral
Very many of the children chose mint chocolates or decided on the cotton candy.,Very few of the children decided on the cotton candy.,entailment
Mr. Thomas had no objection to mr. white being elected chairman.,Mr. Thomas had no problems to mr. black being elected chairman.,entailment
Few aliens drank soda.,Many aliens drank coke.,neutral
So there is no undedicated memory block for every entity and no distinction between entity mentions and non-mention words.,So there is no dedicated high-dimensional memory block for every entity and no distinction between entity mentions and non-mention words.,entailment
Every alien who did not play with any toys is hairless.,Every alien who did not play with toy cars is hairy.,neutral
It isn't little fun going mountain climbing by yourself.,It isn't much joy going mountain climbing by yourself.,entailment
Not many children chose any mint chocolates or decided on the cotton candy.,Not few children decided on the cotton candy.,entailment
He is no ordinary master's student.,He is no extraordinary student.,neutral
"If i were a foreigner, i probably couldn't eat raw fish for dinner.","If i were a foreigner, i probably couldn't eat cooked fish.",neutral
There are no other options.,There are no same options for you.,entailment
"We combed police records of the incident but found no precise mention of witnesses seeing a short, bearded man.","We combed police records of the incident but found no mention of witnesses seeing a tall, bearded man.",neutral
Few children decided on the cotton candy.,Many children chose any mint chocolates or decided on the cotton candy.,entailment
Tom has a many friends in Boston.,Tom has a few friends in Boston suburbs.,neutral
No less than five children decided on the cotton candy.,No morer than five children chose mint chocolates or decided on the cotton candy.,entailment
At least one man sang or danced.,At most one man sang.,neutral
Few aliens ate meat.,Many aliens ate pork.,neutral
At most ten female commissioners spend time at home.,At fewest ten commissioners spend time at home.,neutral
He drank a whole bottle of milk.,He drank a fractional 1 liter bottle of milk.,neutral
Tom is facing a few serious problems to face exams.,Tom is facing a few frivolous problems.,entailment
At most three elephants are navy blue.,At fewest three elephants are blue.,neutral
I have not yet collected insufficient materials to write a book.,I have not yet collected sufficient materials to write a history book.,entailment
I didn't understand that first sentence.,I didn't understand that last half of the sentence.,entailment
Many aliens threw some balls.,Few aliens threw tennis balls.,neutral
One thing a unmarried man should never forget is his wedding anniversary.,One thing a married older man should never forget is his wedding anniversary.,entailment
No morer than five campers have caught a cold.,No less than five campers have had a sunburn or caught a cold.,entailment
Tom goes to bed at the other time every night.,Tom goes to rachel's bed at the same time every night.,neutral
Extraordinary things never happen in simple and ordinary ways.,Extraordinary things never happen in simple and extraordinary usual ways.,entailment
Every member of the cabinet was present.,Every participant of the cabinet was future.,entailment
Little Sophie was not obedient.,Large girl Sophie was not obedient.,entailment
It is no wonder that a man of his ability is so unsuccessful.,It is no wonder that a good man of his ability is so successful.,entailment
We have some unfinished business.,We have some finished investigation.,neutral
Many people in Fiji don't have access to clean drinking hot water.,Few people in Fiji don't have access at all to clean drinking water.,neutral
No human power can manage that.,No nonhuman law power can manage that.,entailment
Some large birds prey upon small birds and animals.,Some large birds hunt and prey upon large birds and animals.,neutral
Tom really leads no easy life.,Tom really leads no difficult life unlike others.,entailment
I don't want to miss unhappy hour.,I don't want to miss happy hour for cake.,entailment
Tom isn't a bad romance writer.,Tom isn't a good writer.,neutral
Rudolf has built a small house.,Rudolf has built a large apartment.,neutral
A nonhuman body consists of a countless number of cells.,A human metabolism consists of a countless number of cells.,neutral
This room doesn't get much sun.,This room doesn't get little sun during the day.,entailment
"Picasso was no clown, and he was a sarcastic commentator on a clearheaded age, a great archivist of humanity's foolishness.","Picasso was no jester, and he was a sarcastic commentator on a confused age, a great archivist of humanity's foolishness.",entailment
Every alien who did not throw balls is hairless.,Every alien who did not throw tennis balls is hairy.,neutral
All of them have independent means.,All of them have dependent transport.,neutral
He is no extraordinary student.,He is no ordinary undergraduate student.,entailment
Very many campers have caught a cold.,Very few campers have had a sunburn or caught a cold.,neutral
It isn't little fun going mountain climbing by yourself.,It isn't much entertainment going mountain climbing by yourself.,entailment
Extraordinary things never happen in simple and ordinary ways.,Extraordinary things never happen in simple and extraordinary ways they are complicated.,entailment
She's wearing a nasty summer hat.,She's wearing a nice hat.,entailment
Some important documents on criminal proceedings are missing from the files.,Some unimportant papers are missing from the files.,entailment
"Regional governors could not rely on anyone for help in times of crisis, and the ensuing food shortages and political disputes escalated into famines and small-scale civil wars.","Regional governors could not rely on the king for help in times of crisis, and the ensuing food shortages and nonpolitical disputes escalated into famines and small-scale civil wars.",entailment
She slept for a many dreamless hours.,She slept for a few hours.,neutral
I don't want to make old friends!,I don't want to make new friends distracting me from studying!,entailment
Few aliens ate any meat.,Many aliens ate pork.,entailment
Tom didn't live a long life.,Tom didn't live a short beautiful life.,entailment
Every student has free access to the library.,Every new student has unfree access to the library.,entailment
